{
  "$schema": "http://json-schema.org/draft-07/schema#",
  "$id": "vnext-work-item.schema.json",
  "title": "docs_tdd vNext Work Item",
  "type": "object",
  "required": ["schemaVersion", "workflowVersion", "projectId", "sourceSnapshot", "requirements", "coverageAudit", "routing", "apiDependency"],
  "properties": {
    "schemaVersion": { "const": 1 },
    "workflowVersion": { "const": 2 },
    "projectId": { "type": "string", "pattern": "^PR-\\d{5}$" },
    "deliveryScope": {
      "type": "object",
      "required": ["kind", "batchId", "includedRequirementIds", "deferred"],
      "properties": {
        "kind": { "const": "bounded-batch" },
        "batchId": { "type": "string", "minLength": 1 },
        "includedRequirementIds": {
          "type": "array",
          "minItems": 1,
          "uniqueItems": true,
          "items": { "type": "string", "pattern": "^R-\\d{3}$" }
        },
        "deferred": {
          "type": "object",
          "required": ["owner", "batch", "reason"],
          "properties": {
            "owner": { "type": "string", "minLength": 1 },
            "batch": { "type": "string", "minLength": 1 },
            "reason": { "type": "string", "minLength": 1 }
          },
          "additionalProperties": false
        }
      },
      "additionalProperties": false
    },
    "sourceSnapshot": {
      "type": "object",
      "required": ["revision", "contentHash", "sources"],
      "properties": {
        "revision": { "type": "string", "minLength": 1 },
        "contentHash": { "type": "string", "minLength": 1 },
        "sources": {
          "type": "array",
          "minItems": 1,
          "items": {
            "type": "object",
            "required": ["path", "contentHash"],
            "properties": {
              "path": { "type": "string", "minLength": 1 },
              "contentHash": { "type": "string", "minLength": 1 }
            },
            "additionalProperties": false
          }
        }
      },
      "additionalProperties": false
    },
    "requirements": {
      "type": "array",
      "minItems": 1,
      "items": {
        "type": "object",
        "required": ["requirementId", "sourceAnchors", "statement", "status", "affectedSurfaces", "evidencePlan"],
        "properties": {
          "requirementId": { "type": "string", "pattern": "^R-\\d{3}$" },
          "sourceAnchors": {
            "type": "array",
            "minItems": 1,
            "items": {
              "type": "object",
              "required": ["type", "sourceId"],
              "properties": {
                "type": { "type": "string", "enum": ["text", "table", "image", "embed"] },
                "sourceId": { "type": "string", "minLength": 1 },
                "path": { "type": "string", "minLength": 1 },
                "lineStart": { "type": "integer", "minimum": 1 },
                "lineEnd": { "type": "integer", "minimum": 1 }
              },
              "additionalProperties": false
            }
          },
          "statement": { "type": "string", "minLength": 1 },
          "status": { "type": "string", "enum": ["doing", "not-doing", "deferred"] },
          "collectionSemantics": {
            "type": "object",
            "required": ["kind", "expectedCount"],
            "properties": {
              "kind": { "type": "string", "enum": ["none", "explicit-set", "discovered-set"] },
              "expectedCount": { "type": "integer", "minimum": 0 }
            },
            "additionalProperties": false
          },
          "affectedSurfaces": {
            "type": "array",
            "items": {
              "type": "object",
              "required": ["surfaceId", "locator", "disposition"],
              "properties": {
                "surfaceId": { "type": "string", "pattern": "^S-\\d{3}$" },
                "locator": { "type": "string", "minLength": 1 },
                "disposition": { "type": "string", "enum": ["implement", "already-covered", "not-applicable", "deferred"] },
                "reason": { "type": "string" },
                "owner": { "type": "string" },
                "batch": { "type": "string" }
              },
              "additionalProperties": false
            }
          },
          "evidencePlan": {
            "type": "array",
            "minItems": 1,
            "items": {
              "type": "object",
              "required": ["type", "runtimeRequired"],
              "properties": {
                "type": { "type": "string", "enum": ["copy-literal", "component-dom", "pure-logic", "payload-contract", "api-contract", "browser-interaction", "visual"] },
                "runtimeRequired": { "type": "boolean" }
              },
              "additionalProperties": false
            }
          }
        },
        "additionalProperties": false
      }
    },
    "coverageAudit": {
      "type": "object",
      "required": ["sourceFingerprint", "requirementsFingerprint", "reviewMode", "reviewRunId", "reviewer", "completedAt", "verdict", "unresolved"],
      "properties": {
        "sourceFingerprint": { "type": "string", "minLength": 1 },
        "requirementsFingerprint": { "type": "string", "minLength": 1 },
        "reviewMode": { "const": "independent-cold-read" },
        "reviewRunId": { "type": "string", "minLength": 1 },
        "reviewer": {
          "type": "object",
          "required": ["kind", "id"],
          "properties": {
            "kind": { "type": "string", "enum": ["human", "model"] },
            "id": { "type": "string", "minLength": 1 }
          },
          "additionalProperties": false
        },
        "completedAt": { "type": "string", "format": "date-time" },
        "verdict": { "type": "string", "enum": ["pass", "changes-required"] },
        "findings": {
          "type": "array",
          "items": {
            "type": "object",
            "required": ["findingId", "code", "message", "sourceIds", "disposition"],
            "properties": {
              "findingId": { "type": "string", "minLength": 1 },
              "code": { "type": "string", "enum": ["missing-requirement", "merged-requirement", "ambiguous-collection", "missing-surface", "other"] },
              "message": { "type": "string", "minLength": 1 },
              "sourceIds": { "type": "array", "items": { "type": "string", "minLength": 1 } },
              "disposition": { "type": "string", "enum": ["resolved", "not-applicable", "deferred", "open"] },
              "reason": { "type": "string" },
              "owner": { "type": "string" },
              "batch": { "type": "string" }
            },
            "additionalProperties": false
          }
        },
        "unresolved": { "type": "array", "items": { "type": "string", "minLength": 1 } }
      },
      "additionalProperties": false
    },
    "routing": {
      "type": "object",
      "required": ["scopeClass", "riskSignals", "verificationLevel", "routerVersion"],
      "properties": {
        "scopeClass": { "type": "string", "enum": ["local", "multi-surface", "cross-boundary"] },
        "riskSignals": {
          "type": "array",
          "uniqueItems": true,
          "items": {
            "type": "string",
            "enum": ["password", "authentication-surface", "multiple-entry-points", "shared-component", "contract-change", "funds", "trading", "permission", "irreversible", "new-api", "cross-app", "fee-semantics", "amount-semantics"]
          }
        },
        "verificationLevel": { "type": "string", "enum": ["V0", "V1", "V2"] },
        "routerVersion": { "type": "integer", "minimum": 1 }
      },
      "additionalProperties": false
    },
    "apiDependency": {
      "type": "object",
      "required": ["mode", "reason"],
      "properties": {
        "mode": { "type": "string", "enum": ["no-request", "real-api", "mock-required", "pending-dependency"] },
        "reason": { "type": "string", "minLength": 1 },
        "contractIds": { "type": "array", "uniqueItems": true, "items": { "type": "string", "minLength": 1 } },
        "blockerId": { "type": "string", "minLength": 1 }
      },
      "allOf": [
        {
          "if": { "properties": { "mode": { "const": "mock-required" } }, "required": ["mode"] },
          "then": { "required": ["contractIds"], "properties": { "contractIds": { "minItems": 1 } } }
        },
        {
          "if": { "properties": { "mode": { "const": "pending-dependency" } }, "required": ["mode"] },
          "then": { "required": ["blockerId"] }
        }
      ],
      "additionalProperties": false
    },
    "scopeApproval": {
      "type": ["object", "null"],
      "required": ["confirmationKind", "confirmedBy", "confirmedAt", "fingerprint"],
      "properties": {
        "confirmationKind": { "const": "human" },
        "confirmedBy": { "type": "string", "minLength": 1 },
        "confirmedAt": { "type": "string", "pattern": "^\\d{4}-\\d{2}-\\d{2}$" },
        "fingerprint": { "type": "string", "minLength": 1 }
      },
      "additionalProperties": false
    }
  },
  "additionalProperties": false
}
