{
  "schemaVersion": 1,
  "workflowVersion": 2,
  "projectId": "PR-02233",
  "sourceSnapshot": {
    "revision": "670",
    "contentHash": "9e3a1b2104635c137a715800542084b42d9fd25424f56a25fca1643ba785b78e",
    "sources": [
      {
        "path": "https://qfglxo2m3dc.sg.larksuite.com/docx/QaBEditNroySaGxmywFl8CwXg6d",
        "contentHash": "d8fa7940d84b9db4d7059d166dbf89e7499e5e32523d0801c1256aab77931ae2"
      }
    ]
  },
  "requirements": [
    {
      "requirementId": "R-016",
      "sourceAnchors": [
        {
          "type": "text",
          "sourceId": "SRC-7AD253D17754"
        }
      ],
      "statement": "Place exactly one “没有收到验证码？” entry below the verification input area in each of the 19 listed verification scenes, including dual-verification scenes.",
      "status": "doing",
      "collectionSemantics": {
        "kind": "explicit-set",
        "expectedCount": 19
      },
      "affectedSurfaces": [
        {
          "locator": "No-code-help entry — login",
          "disposition": "implement",
          "surfaceId": "S-042"
        },
        {
          "locator": "No-code-help entry — registration",
          "disposition": "implement",
          "surfaceId": "S-043"
        },
        {
          "locator": "No-code-help entry — forgotten password",
          "disposition": "implement",
          "surfaceId": "S-044"
        },
        {
          "locator": "No-code-help entry — withdrawal including internal transfer",
          "disposition": "implement",
          "surfaceId": "S-045"
        },
        {
          "locator": "No-code-help entry — password set/change",
          "disposition": "implement",
          "surfaceId": "S-046"
        },
        {
          "locator": "No-code-help entry — email set/change",
          "disposition": "implement",
          "surfaceId": "S-047"
        },
        {
          "locator": "No-code-help entry — phone set/change",
          "disposition": "implement",
          "surfaceId": "S-048"
        },
        {
          "locator": "No-code-help entry — third-party bind/unbind",
          "disposition": "implement",
          "surfaceId": "S-049"
        },
        {
          "locator": "No-code-help entry — disable GA",
          "disposition": "implement",
          "surfaceId": "S-050"
        },
        {
          "locator": "No-code-help entry — disable phone verification",
          "disposition": "implement",
          "surfaceId": "S-051"
        },
        {
          "locator": "No-code-help entry — withdrawal-whitelist toggle",
          "disposition": "implement",
          "surfaceId": "S-052"
        },
        {
          "locator": "No-code-help entry — address add/edit including internal address",
          "disposition": "implement",
          "surfaceId": "S-053"
        },
        {
          "locator": "No-code-help entry — account cancellation",
          "disposition": "implement",
          "surfaceId": "S-054"
        },
        {
          "locator": "No-code-help entry — API view",
          "disposition": "implement",
          "surfaceId": "S-055"
        },
        {
          "locator": "No-code-help entry — API management",
          "disposition": "implement",
          "surfaceId": "S-056"
        },
        {
          "locator": "No-code-help entry — API create/edit",
          "disposition": "implement",
          "surfaceId": "S-057"
        },
        {
          "locator": "No-code-help entry — buy-crypto module 1 purchase/sale",
          "disposition": "implement",
          "surfaceId": "S-058"
        },
        {
          "locator": "No-code-help entry — buy-crypto module 2 purchase/sale",
          "disposition": "implement",
          "surfaceId": "S-059"
        },
        {
          "locator": "No-code-help entry — buy-crypto module 3 purchase/sale",
          "disposition": "implement",
          "surfaceId": "S-060"
        }
      ],
      "evidencePlan": [
        {
          "type": "component-dom",
          "runtimeRequired": true
        },
        {
          "type": "browser-interaction",
          "runtimeRequired": true
        }
      ]
    },
    {
      "requirementId": "R-017",
      "sourceAnchors": [
        {
          "type": "text",
          "sourceId": "SRC-EDC46C0F2723"
        }
      ],
      "statement": "The help dialog title is fixed as “没有收到验证码？”; it always shows email and phone tabs, defaults to the currently requested channel (email for dual-channel), and allows content-only tab switching.",
      "status": "doing",
      "collectionSemantics": {
        "kind": "explicit-set",
        "expectedCount": 1
      },
      "affectedSurfaces": [
        {
          "surfaceId": "S-061",
          "locator": "Verification-code help dialog",
          "disposition": "implement"
        }
      ],
      "evidencePlan": [
        {
          "type": "pure-logic",
          "runtimeRequired": false
        },
        {
          "type": "component-dom",
          "runtimeRequired": true
        }
      ]
    },
    {
      "requirementId": "R-018",
      "sourceAnchors": [
        {
          "type": "text",
          "sourceId": "SRC-511F28E07C1D"
        }
      ],
      "statement": "Use the specified email-code delivery and troubleshooting copy in the email help tab.",
      "status": "doing",
      "collectionSemantics": {
        "kind": "explicit-set",
        "expectedCount": 1
      },
      "affectedSurfaces": [
        {
          "surfaceId": "S-062",
          "locator": "Verification-code help dialog",
          "disposition": "implement"
        }
      ],
      "evidencePlan": [
        {
          "type": "copy-literal",
          "runtimeRequired": false
        }
      ]
    },
    {
      "requirementId": "R-019",
      "sourceAnchors": [
        {
          "type": "text",
          "sourceId": "SRC-73216C92C359"
        }
      ],
      "statement": "Use the specified SMS-code delivery and troubleshooting copy in the phone help tab.",
      "status": "doing",
      "collectionSemantics": {
        "kind": "explicit-set",
        "expectedCount": 1
      },
      "affectedSurfaces": [
        {
          "surfaceId": "S-063",
          "locator": "Verification-code help dialog",
          "disposition": "implement"
        }
      ],
      "evidencePlan": [
        {
          "type": "copy-literal",
          "runtimeRequired": false
        }
      ]
    },
    {
      "requirementId": "R-020",
      "sourceAnchors": [
        {
          "type": "text",
          "sourceId": "SRC-6C584FEC3BC3"
        }
      ],
      "statement": "The help-dialog customer-service icon opens chat; “已知晓” closes the dialog; tab changes do not mutate the underlying form.",
      "status": "doing",
      "collectionSemantics": {
        "kind": "explicit-set",
        "expectedCount": 1
      },
      "affectedSurfaces": [
        {
          "surfaceId": "S-064",
          "locator": "Verification-code help dialog",
          "disposition": "implement"
        }
      ],
      "evidencePlan": [
        {
          "type": "browser-interaction",
          "runtimeRequired": true
        }
      ]
    }
  ],
  "coverageAudit": {
    "sourceFingerprint": "a4114cd9071758bb2bb1bf210e2b9ab13ebffd6e4a2ab98c6cb30b77857020af",
    "requirementsFingerprint": "d68883bfe96e6bdd62759f4e8f0bb5dc57db0b2077364bfc9896c9a610991155",
    "reviewMode": "independent-cold-read",
    "reviewRunId": "cold-review-remediation-PR-02233-20260904-subset-03-help-dialog",
    "reviewer": {
      "kind": "model",
      "id": "uniaix/gpt-5.6-terra-independent-remediation"
    },
    "completedAt": "2026-09-04T08:30:00Z",
    "verdict": "pass",
    "findings": [],
    "unresolved": []
  },
  "routing": {
    "scopeClass": "cross-boundary",
    "riskSignals": [
      "contract-change",
      "cross-app",
      "funds",
      "irreversible",
      "multiple-entry-points",
      "permission",
      "shared-component"
    ],
    "verificationLevel": "V2",
    "routerVersion": 1
  },
  "apiDependency": {
    "mode": "mock-required",
    "reason": "Human owner confirmed on 2026-09-04 that most flows reuse existing APIs; the small set of added or changed contracts proceeds through MSW route B until real-contract reconciliation.",
    "contractIds": [
      "AUTH-METHODS-V1",
      "AUTH-CHANNEL-SWITCH-V1",
      "VERIFY-COOLDOWN-V1"
    ]
  },
  "scopeApproval": {
    "confirmationKind": "human",
    "confirmedBy": "Aven",
    "confirmedAt": "2026-09-04",
    "fingerprint": "db782f3cc26393f0014851f5ee91f6f5a290f42db94f48b2464148430844d8a5"
  }
}
